PortalID,Status,LastUpdated,AgencyDept,Title,Type,LOI,Categories,Purpose,Description,ApplicantType,FundingSource,MatchingFunds,EstAvailFunds,FundingMethod,OpenDate,ApplicationDeadline,ExpAwardDate,GrantURL,MaxAwards,MinAwards,MaxAmounts,MinAmounts,IsOngoing
8681,active,2022-01-28 22:41:07,Department of Housing and Community Development,2021 HOME NOFA Amendment (Tribal Entities Only),Grant; Loan,Yes,"Housing, Community and Economic Development",The intended outcomes from this grant opportunity are as follows:Create approximately 150 new units of affordable rental housingCreate approximately 25 new affordable single family homes for purchase Assist with the purchase or rehabilitation of approximately 250 affordable single-family residencesProvide approximately 24 months of rental assistance to 300 low-income households.,"The HOME Program is intended to fund a variety of projects and programs. Applicants can include Cities, Counties, Tribal Entities or Tribally Designated Housing Authorities, Community Housing Development Organizations, and other Developers.  Activities funded include the acquisition and new construction or rehabilitation of multi-family projects providing housing to income-eligible tenants, the development of single-family residences to be sold to income-eligible households, and to fund local programs that provide first-time homebuyer downpayment assistance, owner-occupied rehabilitation, and tenant-based rental assistance. Cities, Counties and Tribal entities are eligible only if they do not receive a direct HOME allocation from HUD. Developers and CHDOs must locate their projects to serve communities that do not receive a direct HOME allocation from HUD.  Projects may receive a grant or loan depending on the applicant for up to $7M. Programs maximum grant amount will be $2M and applicants can utilize the funds for any of or all three of the eligible activities to fund fund homebuyer downpayment loans, owner-occupied rehabilitation loans/grants and tenant-based rental assistance grants.  KEYWORDS  rehabilitationdownpayment assistancetenant-based rental assistancerental housingHOME     *** NOTE: This application deadline extension is for Tribal Entities Only, see separate opportunity for City, County, Developers***  This funding provides loans or grants to eligible HOME Applicants serving low-income (at or below 80 percent of Area Median Income (AMI)) and very low-income (at or below 50 percent of AMI) households.  All housing assisted with these funds will be occupied by households that meet the income restrictions for the program which require the funds go to serve households whose incomes are at or below 80% AMI.    ",Tribal Government,Federal,Not Required,72000000.0,Reimbursement(s),2022-01-28 08:00:00,Ongoing,July 2022,https://www.hcd.ca.gov/grants-funding/active-funding/home.shtml,,,,,1
8624,active,2022-03-17 17:07:15,Coastal Conservancy,Wildfire Resilience (Ongoing),Grant,No,Disaster Prevention & Relief; Environment & Water,The Wildfire Resilience Program supports local partners to develop and implement projects that improve ecological health of natural lands and reduce the risk of catastrophic fire.   ,"The program will fund grants for: on-the-ground activities to restore the health and increase resilience of California forests, grasslands, and natural lands to wildfire; and planning and capacity building to increase wildfire resilience in California for projects from Marin County south to Ventura County.",Nonprofit; Public Agency; Tribal Government,State,Not Required,17000000.0,Reimbursement(s),2022-01-24 08:00:00,Ongoing,By May 2022,https://scc.ca.gov/2021/12/03/rfp-for-wildfire-resilience-projects-announced/,,,,,1
5302,active,2022-01-11 21:33:45,Department of Transportation,Airport Improvement Program Matching Grant,Grant,No,Transportation,Provides airport sponsor's a portion of the local match required for a Federal Aviation Administration Airport Improvement Program (AIP) grant to eligible public-use general aviation airports.,"This is a reimbursable grant for airport development or planning activities. The State will provide up to 5% of total AIP grant with a project maximum of $150,000 per project.  Project must be listed in the State Capital Improvement Plan to be eligible.  Project must not begin until a notice to proceed is given by the State",Public Agency,State,Not Required,2500000.0,Reimbursement(s),2022-01-11 22:00:00,Ongoing,Continuous,https://dot.ca.gov/programs/aeronautics/airport-improvement-program-matching-grant,,,,,1
5299,active,2022-06-09 14:34:06,Department of Transportation,Local Airport Loan Program,Loan,No,Transportation,This program provides discretionary State loans to eligible public-use airports for projects that enhance an airport’s ability to provide general aviation services.      ,"Types of projects funded by these loans include hangars, General Aviation (GA) terminals, utilities, GA fueling facilities, Caltrans Acquisition and Development eligible projects, or local share for a federal Airport Improvement Program grant.  The maximum term of a loan is 17 years.  The Department approves the amount of the loan in accordance with the project’s feasibility and the sponsor’s financial situation. For details including eligibility, please see the publication, State Dollars for Your Airport (PDF), Chapter 2; and the California Code of Regulations, Title 21, Division 2.5, Chapter 5, California Airport Loan Program.",Public Agency,State,Not Required,300000.0,Advances & Reimbursement(s),2022-01-11 22:00:00,Ongoing,Continuous,https://dot.ca.gov/programs/aeronautics/airport-loans,,,,,1
11555,active,2022-01-05 08:00:00,CA Arts Council,External JSON Grant No Deadline,Grant,No,"Employment, Labor & Training","Nullam suscipit, lorem sed sollicitudin tempus, libero diam dapibus dolor, semper semper elit arcu sed justo.","Nullam suscipit, lorem sed sollicitudin tempus, libero diam dapibus dolor, semper semper elit arcu sed justo.",Nonprofit,State,Not Required,100000.0,Advance(s),2022-01-05 08:00:00,Ongoing,1/1/2023,https://10up.com,50.0,50.0,,,1
8237,active,2022-07-13 00:01:54,Department of Forestry and Fire Protection,Workforce and Business Development,Grant,No,"Disadvantaged Communities; Employment, Labor & Training; Energy; Science, Technology, and Research & Development; Transportation",CAL FIRE's Wood Products and Bioenergy team seeks to maintain and enhance the wood products infrastructure of California to promote healthy resilient forests throughout the state by supporting a diverse set of business development and workforce development projects.  ,"Eligible business development projects include facilities, operations, and professional services that support the restoration of healthy, resilient forests.   Eligible workforce development projects include universities, colleges, government and community organizations, and businesses that aim to increase workforce capacity in the fields of logging, fuels treatment, transportation, manufacturing, or other support services that bolster the development of a resilient forest sector workforce.   Research and development projects related to both business and workforce development will also be considered. Check out the Wood Products website and subscribe for updates.     ",Business; Individual; Nonprofit; Public Agency; Tribal Government,State,200%,28000000.0,Reimbursement(s),2022-01-03 08:00:00,Ongoing,Early Q2 2022,https://www.fire.ca.gov/programs/resource-management/climate-change-and-energy/wood-products-and-bioenergy-program/,,,,,1
7982,active,2022-03-18 17:21:23,Department of Parks and Recreation,Division of Boating and Waterways Law Enforcement Financial Aid Program FY22,Grant,No,"Environment & Water; Law, Justice, and Legal Services; Parks & Recreation",Assist local government agencies with funding for marine law enforcement.,This program provides state financial aid to local government agencies whose waterways have high usage of boaters and insufficient tax base to fully fund a marine law enforcement boating safety program.,Public Agency,State,Not Required,11500000.0,Reimbursement(s),2022-01-01 08:00:00,2022-12-31 00:00:00,Contingent,https://dbw.parks.ca.gov/?page_id=28781,40.0,40.0,,,1
6325,active,2022-06-30 16:36:48,Department of Toxic Substances Control,Brownfields Revolving Loan Fund (RLF) Grant Program,Grant,No,Environment & Water,"The Revolving Loan Fund (RLF) Grant Program purpose is to help facilitate assessing and cleaning up contaminated sites by granting funds to nonprofits, tribal entitles, and local governments.","The RLF Grant Program provides grants to help nonprofits, tribal entities, and local governments who are not potentially liable under CERCLA section 107 assess or clean up brownfields that they own. DTSC accepts applications continuously, subject to fund availability.",Nonprofit; Public Agency; Tribal Government,State,Not Required,1600000.0,Reimbursement(s),2021-12-22 08:00:00,Ongoing,Continuous basis,https://dtsc.ca.gov/revolving-loan-fund-rlf-program/,,,350000.0,0.0,1
7583,active,2022-06-27 22:49:07,Coachella Valley Mountains Conservancy,Climate Resilience and Community Access Grant Program,Grant,No,Disadvantaged Communities; Environment & Water; Parks & Recreation,"Enhance the Coachella Valley's capacity to respond to climate change, provide equitable access to outdoor recreation for all communities and improve natural resource management.","The grants seek to invest in the local conservation community by creating new programs or developing organizational or agency capacity to enhance desert resilience to climate change and foster conservation of the desert as a carbon sink; promote equity in access to outdoor recreation throughout the Valley; or improve natural resources management on existing conservation lands.  Applications that represent a sustainable investment, incubate local expertise and capacity and serve historically underserved and economically disadvantage communities are especially encouraged.  Grants should be for projects of up to 24 months, and grant requests should range from $100,000- - $400,000.  Local governments, tribes and nonprofits are eligible to apply.  ",Nonprofit; Public Agency; Tribal Government,State,Not Required,2500000.0,Advances & Reimbursement(s),2021-11-09 08:00:00,Ongoing,March 2022,http://www.cvmc.ca.gov,,,400000.0,100000.0,1
7361,active,2021-11-30 16:56:44,CA State Transportation Agency,TIRCP Webinar for Rural and Small Agencies,Grant,No,Transportation,"TIRCP was created to fund transformative capital improvements that modernize and reduce greenhouse gases of  California’s intercity rail, bus, feeder buses to intercity rail services, vanpool services, ferry, and rail transit systems. Section 75221(c) of the PRC establishes a programmatic goal to provide at least 25 percent of available funding to projects that provide a direct, meaningful, and assured benefit to disadvantaged communities.","The Transit and Intercity Rail Capital Program (TIRCP) was created by Senate Bill (SB) 862 (Chapter 36, Statutes of 2014) and modified by Senate Bill 9 (Chapter 710, Statutes of 2015), to provide grants from the Greenhouse Gas Reduction Fund (GGRF) to fund transformative capital improvements that will modernize California’s intercity, commuter, and urban rail systems, and bus and ferry transit systems, to significantly reduce emissions of greenhouse gases, vehicle miles traveled, and congestion. There have been four prior cycles of TIRCP funding, in which the California State Transportation Agency (CalSTA) has awarded $5.8 billion in funding to 73 projects throughout the state.  The legislation of these bills is established in Sections 75220 through 75225 of the Public Resources Code (PRC).  Assembly Bill 398 (Chapter 135) extended the Cap and Trade Program that supports the TIRCP from 2020 through 2030.  SB 1 (Chapter 5) continues to provide a historic funding increase for transportation with funds directed to the TIRCP from the Public Transportation Account for new programming.",Public Agency,State,Not Required,5000000.0,Other,2021-11-03 07:00:00,Ongoing,"June, 2022",https://calsta.ca.gov/subject-areas/transit-intercity-rail-capital-prog,,,,,1
7343,active,2021-11-30 16:57:15,CA State Transportation Agency,TIRCP Webinar for Large Transit Agencies,Grant,No,Transportation,"TIRCP was created to fund transformative capital improvements that modernize and reduce greenhouse gases of  California’s intercity rail, bus, feeder buses to intercity rail services, vanpool services, ferry, and rail transit systems. Section 75221(c) of the PRC establishes a programmatic goal to provide at least 25 percent of available funding to projects that provide a direct, meaningful, and assured benefit to disadvantaged communities.","The Transit and Intercity Rail Capital Program (TIRCP) was created by Senate Bill (SB) 862 (Chapter 36, Statutes of 2014) and modified by Senate Bill 9 (Chapter 710, Statutes of 2015), to provide grants from the Greenhouse Gas Reduction Fund (GGRF) to fund transformative capital improvements that will modernize California’s intercity, commuter, and urban rail systems, and bus and ferry transit systems, to significantly reduce emissions of greenhouse gases, vehicle miles traveled, and congestion. There have been four prior cycles of TIRCP funding, in which the California State Transportation Agency (CalSTA) has awarded $5.8 billion in funding to 73 projects throughout the state.  The legislation of these bills is established in Sections 75220 through 75225 of the Public Resources Code (PRC).  Assembly Bill 398 (Chapter 135) extended the Cap and Trade Program that supports the TIRCP from 2020 through 2030.  SB 1 (Chapter 5) continues to provide a historic funding increase for transportation with funds directed to the TIRCP from the Public Transportation Account for new programming.",Public Agency,State,Not Required,5000000.0,Other,2021-11-02 07:00:00,Ongoing,"June, 2022",https://calsta.ca.gov/subject-areas/transit-intercity-rail-capital-prog,,,,,1
6598,active,2022-07-06 20:57:45,Department of Fish and Wildlife,Qualified Cultivator Funding Opportunity,Grant,No,Environment & Water,"The California Department of Fish and Wildlife (CDFW) is seeking high quality grant proposals for eligible applicants to assist qualified cannabis cultivators and enhance CDFW’s mission to manage California’s diverse fish, wildlife, and plant resources, and the habitats upon which they depend, for their ecological values and for their use and enjoyment by the public.","Applications may be considered under one or both of the following project priorities.  Project Type - Transition from Provisional License to Annual License: To transition to an annual license, provisional licensees must meet all regulatory requirements in Title 3 of the California Code of Regulations, sections 8102, 8105, and 8106. Eligible activities under this project type include, but are not limited to: cleanup, remediation, and restoration, professional services, consulting, and infrastructure related to cleanup, remediation, and restoration. Eligible costs include but are not limited to: compliance costs (except the ineligible costs described above); meeting the avoidance, minimization, or mitigation requirements approved in the project’s CEQA document; or county permitting requirements.  If the applicant is representing a provisional license cultivator, actions outlined must lead to the issuance of an annual license or lead to on-the-ground implementation that will result in the issuance of an annual license from the licensing authority.  Project Type - Sustainable Cannabis Cultivation Practices: Sustainable cannabis cultivation practices should alleviate direct and indirect environmental impacts of cannabis cultivation and enhance environmental stewardship. Activities that may be eligible include but are not limited to: sustainable water consumption, sustainable waste management, integrated pest and disease management, erosion control, and/or riparian protection.  Qualified Cultivator - The following qualified cultivator may be represented by an eligible applicant. The qualified cultivator being represented by the eligible applicant must at a minimum have a valid and active provisional license or annual license issued by the California Department of Food and Agriculture (CDFA; now the Department of Cannabis Control). Bus. & Prof. Code, § 26050.2 et seq.). Priority will be given to qualified cultivators with ownership and/or financial interest in no more than 10,000 square feet of total canopy. However, cultivators with ownership and/or financial interest accumulating between 10,000-20,000 square feet of total canopy may still qualify.  All proposed projects must benefit qualified cultivators as defined below. Qualified cultivation license types are:  Specialty cottage:-“Specialty Cottage Outdoor” is an outdoor cultivation site with up to 25 mature plants.-“Specialty Cottage Mixed-Light Tier 1” only, is a mixed-light cultivation site with 2,500 square feet or less of total canopy  Specialty:-“Specialty Outdoor” is an outdoor cultivation site with less than or equal to 5,000 square feet of total canopy, or up to 50 mature plants.-“Specialty Mixed-Light Tier 1” only, is a mixed-light cultivation site between 2,501 and 5,000 square feet of total canopy.  Small:- “Small Outdoor” is an outdoor cultivation site between 5,001 and 10,000 square feet of total canopy.- “Small Mixed-Light Tier 1” only, is a mixed-light cultivation site between 5,001 and 10,000 square feet of total canopy.  “Mixed-light Tier 1” is without the use of artificial light or the use of artificial light at a rate above zero, but no more than six watts per square foot.",Nonprofit; Public Agency; Tribal Government,State,Not Required,6000000.0,Reimbursement(s),2021-10-11 07:00:00,2023-04-30 16:00:00,Rolling Basis,https://wildlife.ca.gov/Conservation/Watersheds/Cannabis-Restoration-Grant,,,,,1
6601,active,2021-08-13 22:07:04,Department of Resources Recycling and Recovery,Farm and Ranch Solid Waste Cleanup and Abatement Grant Program,Grant,Yes,Agriculture; Disadvantaged Communities; Environment & Water,"Provides funding to help cleanup and prevent illegal dumping on 'farm and/or ranch' property, as defined in California Code of Regulations (CCR), Section 17991(d). Usually three application cycles are available each fiscal year; this is the second cycle. CalRecycle offers this Program pursuant to Section 48100 of the Public Resources Code (PRC).","Project sites shall be located on 'farm and ranch' property (both private and public land are eligible), where the owner is not responsible for the illegal disposal. 'Farm and ranch' property is defined in the Eligible Geographies section below.   Grantees have approximately two years to complete the project(s). Sites shall be fully remediated (cleaned up) with grant funds, or a combination of grant funds and in-kind funds/services. Funding includes reimbursement for Administrative, Recycling/Disposal (tires), Equipment, Material, and Personnel costs. Abatement/prevention measures shall be addressed if needed, such as site security and public education/outreach efforts. Innovation is encouraged.   See the Notice of Funds Available FY21-22 webpage for additional information and requirements (specifically, refer to the Application Guidelines and Instructions and Procedures and Requirements resource documents).   Sites that have been previously remediated, homeless encampments, and illegal cannabis grows may also be eligible.  The application usually entails the follow items for each project/site: Budget, Land Use/Zoning Designation, photos, Property Affidavit, a Site Characterization, map, Work Plan, and Resolution. The Resolution is conducted through the applicant's governing body (more info available).  Multiple projects/sites may be included in one application.",Public Agency; Tribal Government,State,Not Required,250000.0,Reimbursement(s),2021-08-13 07:00:00,Ongoing,1/18/22,https://calrecycle.ca.gov/lea/grantsloans/farmranch,,,,,1
6583,active,2022-01-27 19:19:01,Department of Water Resources,Small Community Drought Relief Program,Grant,No,Disadvantaged Communities; Disaster Prevention & Relief; Environment & Water; Health & Human Services,The purpose of the Small Community Drought Relief Program is to provide immediate and near-term financial and technical support to help small communities survive this and future droughts. ,"The Small Community Drought Relief Program (Program) was authorized by the Legislature pursuant to the Budget Act of 2021 (Stats. 2021, ch. 240, § 80) and its Trailer Bill, (Wat. Code, § 13198 et seq.). The Trailer Bill authorized specified state agencies, defined as implementing agencies, subject to an appropriation for these purposes, to make grants and direct expenditures for interim or immediate relief in response to conditions arising from a drought scenario to address immediate impacts on human health and safety and on fish and wildlife resources and to provide water to persons or communities that lose or are threatened with the loss or contamination of water supplies.  The small communities are those that are not supplied by an urban water suppliers as defined in California Water Code (Sec 10617). Urban water suppliers are those that provide drinking water with more than 3,000 connections or more than 3,000 acre-feet per year.",Nonprofit; Public Agency; Tribal Government,State,Not Required,190000000.0,Reimbursement(s),2021-08-11 07:00:00,2023-12-29 00:00:00,August 2021,https://water.ca.gov/-/media/DWR-Website/Web-Pages/Water-Basics/Drought/Files/Resources/SCDRP-Guidelines_Version-2.pdf,,,,,1
6460,active,2022-06-14 16:39:32,Department of Toxic Substances Control,Equitable Community Revitalization Grants (ECRG),Grant,No,"Disadvantaged Communities; Environment & Water; Housing, Community and Economic Development",DTSC’s Office of Brownfields Equitable Community Revitalization Grant will provide about $270+ million in grants through a competitive process for:    Community-wide assessments  Environmental investigations  Environmental cleanups,"The Department of Toxic Substances Control's (DTSC) Site Mitigation and Restoration Program Office of Brownfield manages the Equitable Community Revitalization Grant, which provides about $270+ million in grants through a competitive process for investigations and cleanup of brownfields, in disadvantaged, vulnerable communities, to protect public health and provide opportunities for community revitalization.",Nonprofit; Public Agency; Tribal Government,State,Not Required,270500000.0,Reimbursement(s),2021-08-09 07:00:00,Ongoing,First Round: 4/2022,https://dtsc.ca.gov/brownfields/,,,,,1
1149,active,2021-07-01 16:13:05,State Water Resources Control Board,Site Cleanup Subaccount Program,Grant,Yes,Disadvantaged Communities; Environment & Water,"The Site Cleanup Subaccount Program (SCAP) is a non‐competitive funding program established by Health & Safety Code Section 25299.50.6 in 2014.  It allows the State Water Resources Control Board to issue grants for reasonable and necessary costs associated with projects that remediate the harm or threat of harm to human health, safety, or the environment caused by existing or threatened surface or groundwater contamination.","SCOPE:  Grants to remediate the harm or threat of harm from surface or groundwater contamination by human-made contaminants. ELIGIBILITY:  A regulatory agency has issued a directive (unless this is infeasible); and the responsible party lacks financial resources needed to comply with the directive. PRIORITIES:  Significant threat to human health or the environment; small or disadvantaged community impact; lack of other sources of funds; cost and environmental benefit of project; other considerations. LIMITS ON APPLICATION SUBMISSION:  One applicant per site. APPLICATION PROCESS:  Accepted continuously online, through FAAST. PAST GRANT AMOUNTS:  Range from $95,000 to $3,400,000. NUMBER OF AWARDS AS OF JUNE 2020: 75 KEYWORDS:  Site cleanup, remediation, site investigation, groundwater, vapor intrusion",Business; Nonprofit; Public Agency,State,Not Required,34000000.0,Reimbursement(s),2021-07-01 07:00:00,Ongoing,Continuous,https://www.waterboards.ca.gov/water_issues/programs/grants_loans/scap/,85.0,65.0,,,1
